{
  "schema_version": "setup-registry.v8",
  "summary_columns": [
    "tool",
    "type",
    "required",
    "dependency",
    "host_config",
    "project_bootstrap",
    "result",
    "next_action"
  ],
  "defaults": {
    "tool": {},
    "helper": {},
    "provider": {}
  },
  "install_mirrors": {
    "npm": {
      "endpoint": "https://registry.npmmirror.com",
      "environment": {
        "NPM_CONFIG_REGISTRY": "https://registry.npmmirror.com",
        "npm_config_registry": "https://registry.npmmirror.com"
      }
    }
  },
  "external_dependencies": [
    {
      "id": "codegraph",
      "ecosystem": "npm",
      "package": "@colbymchenry/codegraph",
      "version": "1.4.1",
      "command": "codegraph"
    },
    {
      "id": "graphify",
      "ecosystem": "pypi",
      "package": "graphifyy",
      "version": "0.9.12",
      "command": "graphify",
      "python": {
        "requires": ">=3.10",
        "allow_managed_download": false
      },
      "installers": {
        "preference": [
          "uv",
          "pipx"
        ],
        "plain_pip_allowed": false
      },
      "distribution": {
        "wheel_url": "https://files.pythonhosted.org/packages/76/0c/5c52d9e5b535d22c529417e219e23ad2c04532d4d9ca239abc21518f111a/graphifyy-0.9.12-py3-none-any.whl",
        "sha256": "94f9d0d7ef68455a2055c7623fb9574c7a781afb1473d26c7936d1abfc14d62c",
        "index_url": "https://pypi.org/simple"
      },
      "hook_normalization_contract": "graphify-python-hook-normalization.v1"
    }
  ],
  "hosts": {
    "claude": {
      "id": "claude",
      "defaults": {
        "tool": {
          "host_config": {
            "scope": "managed",
            "targets": {
              "managed": {
                "config_path": {
                  "macos": "/Library/Application Support/ClaudeCode/managed-mcp.json",
                  "linux": "/etc/claude-code/managed-mcp.json",
                  "wsl": "/etc/claude-code/managed-mcp.json",
                  "windows": "C:\\Program Files\\ClaudeCode\\managed-mcp.json"
                },
                "config_format": "json",
                "precedence": 100,
                "writable_check": "parent-or-file"
              },
              "user": {
                "config_path": "$HOME/.claude.json",
                "config_format": "json",
                "precedence": 10,
                "writable_check": "parent-or-file"
              }
            },
            "fallback_order": [
              "managed",
              "user"
            ],
            "uninstall_targets": [
              "managed",
              "user"
            ]
          }
        },
        "helper": {},
        "provider": {}
      }
    },
    "codex": {
      "id": "codex",
      "defaults": {
        "tool": {
          "host_config": {
            "scope": "user",
            "targets": {
              "user": {
                "config_path": "$HOME/.codex/config.toml",
                "config_format": "toml",
                "precedence": 50,
                "writable_check": "parent-or-file"
              },
              "system": {
                "config_path": "/etc/codex/config.toml",
                "config_format": "toml",
                "precedence": 100,
                "writable_check": "file-only"
              }
            },
            "fallback_order": [
              "user"
            ],
            "uninstall_targets": [
              "user",
              "system"
            ]
          }
        },
        "helper": {},
        "provider": {}
      }
    },
    "cursor": {
      "id": "cursor",
      "defaults": {
        "tool": {
          "host_config": {
            "scope": "project",
            "targets": {
              "project": {
                "config_path": ".cursor/mcp.json",
                "config_format": "json",
                "precedence": 50,
                "writable_check": "parent-or-file"
              },
              "user": {
                "config_path": "$HOME/.cursor/mcp.json",
                "config_format": "json",
                "precedence": 100,
                "writable_check": "parent-or-file",
                "requires_user_scope_opt_in": true
              }
            },
            "fallback_order": [
              "project"
            ],
            "uninstall_targets": [
              "project",
              "user"
            ]
          }
        },
        "helper": {},
        "provider": {}
      }
    },
    "kiro": {
      "id": "kiro",
      "defaults": {
        "tool": {
          "host_config": {
            "scope": "workspace",
            "targets": {
              "workspace": {
                "config_path": ".kiro/settings/mcp.json",
                "config_format": "json",
                "precedence": 50,
                "writable_check": "parent-or-file"
              },
              "user": {
                "config_path": "$HOME/.kiro/settings/mcp.json",
                "config_format": "json",
                "precedence": 100,
                "writable_check": "parent-or-file",
                "requires_user_scope_opt_in": true
              }
            },
            "fallback_order": [
              "workspace"
            ],
            "uninstall_targets": [
              "workspace",
              "user"
            ]
          }
        },
        "helper": {},
        "provider": {}
      }
    },
    "qoder": {
      "id": "qoder",
      "defaults": {
        "tool": {
          "host_config": {
            "scope": "local",
            "targets": {
              "local": {
                "config_path": ".qoder/settings.local.json",
                "config_format": "json",
                "precedence": 50,
                "writable_check": "parent-or-file"
              },
              "user": {
                "config_path": "$HOME/.qoder/settings.json",
                "config_format": "json",
                "precedence": 100,
                "writable_check": "parent-or-file",
                "requires_user_scope_opt_in": true
              }
            },
            "fallback_order": [
              "local"
            ],
            "uninstall_targets": [
              "local",
              "user"
            ]
          }
        },
        "helper": {},
        "provider": {}
      }
    }
  },
  "tools": [
    {
      "id": "sequential-thinking",
      "name": "Sequential Thinking",
      "summary_label": "Sequential Thinking",
      "required": true,
      "category": "mcp",
      "host_config_required": true,
      "description": "动态反思性问题解决，spec-first 全工作流通用依赖",
      "dependencies": [
        "node",
        "npx"
      ],
      "detection": {
        "kind": "host_config_exact",
        "key": "sequential-thinking"
      },
      "installation": {
        "kind": "warmup"
      },
      "project_bootstrap": {
        "kind": "none",
        "required": false
      },
      "host_overrides": {
        "claude": {
          "host_config": {
            "command": "npx",
            "args": [
              "-y",
              "@modelcontextprotocol/server-sequential-thinking@latest"
            ]
          }
        },
        "codex": {
          "host_config": {
            "command": "npx",
            "args": [
              "-y",
              "@modelcontextprotocol/server-sequential-thinking@latest"
            ]
          }
        },
        "kiro": {
          "host_config": {
            "command": "npx",
            "args": [
              "-y",
              "@modelcontextprotocol/server-sequential-thinking@latest"
            ]
          }
        },
        "qoder": {
          "host_config": {
            "command": "npx",
            "args": [
              "-y",
              "@modelcontextprotocol/server-sequential-thinking@latest"
            ]
          }
        },
        "cursor": {
          "host_config": {
            "type": "stdio",
            "command": "npx",
            "args": [
              "-y",
              "@modelcontextprotocol/server-sequential-thinking@latest"
            ]
          }
        }
      },
      "platform_overrides": {
        "macos": {
          "installation": {
            "command": "npx",
            "args": [
              "-y",
              "@modelcontextprotocol/server-sequential-thinking@latest",
              "--help"
            ]
          }
        },
        "linux": {
          "installation": {
            "command": "npx",
            "args": [
              "-y",
              "@modelcontextprotocol/server-sequential-thinking@latest",
              "--help"
            ]
          }
        },
        "wsl": {
          "installation": {
            "command": "npx",
            "args": [
              "-y",
              "@modelcontextprotocol/server-sequential-thinking@latest",
              "--help"
            ]
          }
        },
        "windows": {
          "installation": {
            "command": "npx",
            "args": [
              "-y",
              "@modelcontextprotocol/server-sequential-thinking@latest",
              "--help"
            ]
          }
        }
      }
    },
    {
      "id": "context7",
      "name": "Context7",
      "summary_label": "Context7",
      "required": true,
      "category": "mcp",
      "host_config_required": true,
      "description": "最新框架文档查询，spec-first 全工作流通用依赖",
      "dependencies": [
        "node",
        "npx"
      ],
      "detection": {
        "kind": "host_config_exact",
        "key": "context7"
      },
      "installation": {
        "kind": "warmup"
      },
      "project_bootstrap": {
        "kind": "none",
        "required": false
      },
      "host_overrides": {
        "claude": {
          "host_config": {
            "command": "npx",
            "args": [
              "-y",
              "@upstash/context7-mcp@latest"
            ]
          }
        },
        "codex": {